python3 -u main.py $IQ --model gem --expt_name all_gem --n_memories 512 --batch_size 128 --n_epochs 50 
                    --lr 0.03 --glances 1 --memory_strength 0.5   --increment 5 
                    --log_every 3125 --class_order random --samples_per_task -1 
                    --seed $SEED --grad_clip_norm 5.0 --calc_test_accuracy --validation 0.3

python3 -u main.py $IQ --model bcl_dual --expt_name bcl_basic_test --data_path data/rff/rfmls 
                    --n_layers 2 --n_hiddens 100 --xav_init --glances 1 --n_epochs 20 
                    --batch_size 64 --replay_batch_size 10 --memories 400 --lr 0.03 
                    --increment 5 --log_every 3125 --class_order random 
                    --seed $SEED --validation 0.2 --samples_per_task -1 --classes_per_it 6 
                    --iterations 5000 --test_batch_size 100000 --n_memories 5192 --memory_strength 1.0 
                    --steps_per_sample 1 --gamma 1.0 --beta 0.1 --batches_per_example 1 
                    --opt_lr 0.1 --opt_wt 0.1 --alpha_init 0.1 --cifar_batches 3 --grad_clip_norm 5.0 
                    --second_order --bcl_n_memories 2000 --bcl_memory_strength 1.0 --bcl_temperature 2.0 
                    --bcl_inner_steps 5 --bcl_n_meta 5 --bcl_adapt_lr 0.1 --train_mc_iters 2 
                    --std_init 0.02 --mean_eta 50.0 --fisher_gamma 0.95 --rln 7 --update_steps 10 
                    --meta_lr 0.001 --update_lr 0.1

python3 -u main.py $IQ --model meralg1 --expt_name all_meralg1 --batch_size 128 --memories 5192 --replay_batch_size 64 --n_epochs 15
                    --lr 0.1 --beta 0.1 --gamma 1.0 --batches_per_example 10  --increment 5 
                    --log_every 3125 --grad_clip_norm 10.0 --class_order random 
                    --seed $SEED --calc_test_accuracy --validation 0.3 --samples_per_task -1

Logging IQ experiment suite to logs/iq_experiments/run_20251222_121241.log
New Experiment Starting...
Running model:  meralg1
Set seed 0
Loaded task0.npz: Unique train labels: [0 1 2 3 4 5]
Loaded task0.npz: Remapped labels: [0 1 2 3 4 5]. Size: 17294)
Loaded task1.npz: Unique train labels: [ 0  6  7  8  9 10]
Loaded task1.npz: Remapped labels: [ 6  7  8  9 10 11]. Size: 32208)
n_outputs: 12 	n_tasks: 2
True
Model device: cuda:0
---- Eval at Epoch 0: [0.17730529378345353, 0.15571430584597695] ----
Task 0 Epoch 1/1 | Loss 1.1542 | Train Acc 0.9373 | Val Acc 0.1773 | Epoch Time 1608.09s (Eval 8.18s, Train 1599.91s)
---- Eval at Epoch 0: [0.24790618494666922, 0.10587989068348591] ----
Task 1 Epoch 1/1 | Loss 1.0087 | Train Acc 0.9629 | Val Acc 0.1059 | Epoch Time 2873.46s (Eval 8.08s, Train 2865.38s)
####Final Validation Accuracy####
Final Results:- 
 Total Accuracy: 0.18838342285720217 
 Individual Accuracy: [0.2517099039874712, 0.12505694172693319]
logs//meralg1/mer_test_radar-2025-12-22_12-12-44-8974/0/results: {'expt_name': 'mer_test_radar', 'model': 'meralg1', 'arch': 'resnet1d', 'n_hiddens': 100, 'n_layers': 2, 'xav_init': True, 'glances': 1, 'n_epochs': 1, 'batch_size': 128, 'replay_batch_size': 10, 'memories': 400, 'lr': 0.03, 'cuda': True, 'seed': 0, 'log_every': 10, 'log_dir': 'logs//meralg1/mer_test_radar-2025-12-22_12-12-44-8974/0', 'tf_dir': 'logs//meralg1/mer_test_radar-2025-12-22_12-12-44-8974/0/tfdir', 'calc_test_accuracy': False, 'state_logging': False, 'data_path': 'data/rff/radar', 'loader': 'task_incremental_loader', 'samples_per_task': -1, 'shuffle_tasks': False, 'classes_per_it': 6, 'iterations': 5000, 'dataset': 'iq', 'workers': 0, 'validation': 0.5, 'class_order': 'random', 'increment': 5, 'test_batch_size': 100000, 'nc_per_task': 6, 'val_rate': 10, 'opt_lr': 0.1, 'opt_wt': 0.1, 'alpha_init': 0.1, 'learn_lr': False, 'sync_update': False, 'grad_clip_norm': 5.0, 'cifar_batches': 3, 'use_old_task_memory': False, 'second_order': True, 'n_memories': 200, 'memory_strength': 1.0, 'steps_per_sample': 1, 'gamma': 1.0, 'beta': 0.1, 's': 1.0, 'batches_per_example': 1.0, 'bgd_optimizer': 'bgd', 'optimizer_params': '{}', 'train_mc_iters': 2, 'std_init': 0.02, 'mean_eta': 50.0, 'fisher_gamma': 0.95, 'rln': 7, 'update_steps': 10, 'meta_lr': 0.001, 'update_lr': 0.1, 'ctn_lr': 0.01, 'ctn_beta': 0.05, 'ctn_n_meta': 2, 'ctn_inner_steps': 2, 'ctn_temperature': 5, 'ctn_n_memories': 50, 'ctn_alpha_init': 0.1, 'ctn_memory_strength': 100, 'ctn_task_emb': 64, 'bcl_n_memories': 400, 'bcl_memory_strength': 100, 'bcl_temperature': 5, 'bcl_inner_steps': 2, 'bcl_n_meta': 2, 'bcl_adapt_lr': 0.01} # val: 0.186 0.188 0.002 -0.025 # 4513.208045005798
New Experiment Starting...
Running model:  bcl_dual
[STATE 2025-12-22 13:28:01] Experiment 'bcl_basic_test' starting with model 'bcl_dual' (seed 0)
Set seed 0
Loaded task0.npz: Unique train labels: [2 3 5 7 8]
Loaded task0.npz: Remapped labels: [0 1 2 3 4]. Size: 8400)
Loaded task1.npz: Unique train labels: [0 1 4 6 9]
Loaded task1.npz: Remapped labels: [5 6 7 8 9]. Size: 8400)
[STATE 2025-12-22 13:28:02] Loader 'task_incremental_loader' ready: 4096 inputs, 10 outputs, 2 tasks
n_outputs: 10 	n_tasks: 2
[STATE 2025-12-22 13:28:02] Logging to logs//bcl_dual/bcl_basic_test-2025-12-22_13-28-02-4384/0
True
Model device: cuda:0
[STATE 2025-12-22 13:28:02] Model initialized on device cuda:0
[STATE 2025-12-22 13:28:02] Invoking continual life experience flow
[STATE 2025-12-22 13:28:02] Life experience start: 2 tasks queued
[STATE 2025-12-22 13:28:02] Starting task 0 (1/2)
[STATE 2025-12-22 13:28:02] Task 0 Epoch 1/20: entering train loop
[STATE 2025-12-22 13:28:02] Task 0 Epoch 1/20 Iter 0: running validation
---- Eval at Epoch 0: [0.20223174171316585, 0.1955143286429836] ----
Task 0 Epoch 1/20 | Loss 0.4232 | Train Acc 0.9136 | Val Acc 0.2022 | Epoch Time 195.65s (Eval 1.21s, Train 194.44s)
[STATE 2025-12-22 13:31:18] Task 0 Epoch 1/20 complete: 195.65s total (1.21s eval/194.44s train)
[STATE 2025-12-22 13:31:18] Task 0 Epoch 2/20: entering train loop
Task 0 Epoch 2/20 | Loss 0.3327 | Train Acc 0.9647 | Val Acc 0.2022 | Epoch Time 197.76s (Eval 0.00s, Train 197.76s)
[STATE 2025-12-22 13:34:36] Task 0 Epoch 2/20 complete: 197.76s total (0.00s eval/197.76s train)
[STATE 2025-12-22 13:34:36] Task 0 Epoch 3/20: entering train loop
Task 0 Epoch 3/20 | Loss 0.6776 | Train Acc 0.9723 | Val Acc 0.2022 | Epoch Time 199.26s (Eval 0.00s, Train 199.26s)
[STATE 2025-12-22 13:37:55] Task 0 Epoch 3/20 complete: 199.26s total (0.00s eval/199.26s train)
[STATE 2025-12-22 13:37:55] Task 0 Epoch 4/20: entering train loop
Task 0 Epoch 4/20 | Loss 0.7939 | Train Acc 0.9734 | Val Acc 0.2022 | Epoch Time 201.11s (Eval 0.00s, Train 201.11s)
[STATE 2025-12-22 13:41:16] Task 0 Epoch 4/20 complete: 201.11s total (0.00s eval/201.11s train)
[STATE 2025-12-22 13:41:16] Task 0 Epoch 5/20: entering train loop
Task 0 Epoch 5/20 | Loss 0.7158 | Train Acc 0.9766 | Val Acc 0.2022 | Epoch Time 197.83s (Eval 0.00s, Train 197.83s)
[STATE 2025-12-22 13:44:34] Task 0 Epoch 5/20 complete: 197.83s total (0.00s eval/197.83s train)
[STATE 2025-12-22 13:44:34] Task 0 Epoch 6/20: entering train loop
Task 0 Epoch 6/20 | Loss 0.5539 | Train Acc 0.9783 | Val Acc 0.2022 | Epoch Time 198.13s (Eval 0.00s, Train 198.13s)
[STATE 2025-12-22 13:47:52] Task 0 Epoch 6/20 complete: 198.13s total (0.00s eval/198.13s train)
[STATE 2025-12-22 13:47:52] Task 0 Epoch 7/20: entering train loop
Task 0 Epoch 7/20 | Loss 0.5237 | Train Acc 0.9797 | Val Acc 0.2022 | Epoch Time 196.81s (Eval 0.00s, Train 196.81s)
[STATE 2025-12-22 13:51:09] Task 0 Epoch 7/20 complete: 196.81s total (0.00s eval/196.81s train)
[STATE 2025-12-22 13:51:09] Task 0 Epoch 8/20: entering train loop
Task 0 Epoch 8/20 | Loss 0.5044 | Train Acc 0.9823 | Val Acc 0.2022 | Epoch Time 188.52s (Eval 0.00s, Train 188.52s)
[STATE 2025-12-22 13:54:17] Task 0 Epoch 8/20 complete: 188.52s total (0.00s eval/188.52s train)
[STATE 2025-12-22 13:54:17] Task 0 Epoch 9/20: entering train loop
Task 0 Epoch 9/20 | Loss 0.4550 | Train Acc 0.9835 | Val Acc 0.2022 | Epoch Time 191.55s (Eval 0.00s, Train 191.55s)
[STATE 2025-12-22 13:57:29] Task 0 Epoch 9/20 complete: 191.55s total (0.00s eval/191.55s train)
[STATE 2025-12-22 13:57:29] Task 0 Epoch 10/20: entering train loop
Task 0 Epoch 10/20 | Loss 0.5222 | Train Acc 0.9846 | Val Acc 0.2022 | Epoch Time 198.85s (Eval 0.00s, Train 198.85s)
[STATE 2025-12-22 14:00:48] Task 0 Epoch 10/20 complete: 198.85s total (0.00s eval/198.85s train)
[STATE 2025-12-22 14:00:48] Task 0 Epoch 11/20: entering train loop
[STATE 2025-12-22 14:00:48] Task 0 Epoch 11/20 Iter 0: running validation
---- Eval at Epoch 10: [0.7638633429534701, 0.3517752470745247] ----
Task 0 Epoch 11/20 | Loss 0.3907 | Train Acc 0.9858 | Val Acc 0.7639 | Epoch Time 201.16s (Eval 1.17s, Train 199.99s)
[STATE 2025-12-22 14:04:09] Task 0 Epoch 11/20 complete: 201.16s total (1.17s eval/199.99s train)
[STATE 2025-12-22 14:04:09] Task 0 Epoch 12/20: entering train loop
Task 0 Epoch 12/20 | Loss 0.3335 | Train Acc 0.9874 | Val Acc 0.7639 | Epoch Time 197.31s (Eval 0.00s, Train 197.31s)
[STATE 2025-12-22 14:07:26] Task 0 Epoch 12/20 complete: 197.31s total (0.00s eval/197.31s train)
[STATE 2025-12-22 14:07:26] Task 0 Epoch 13/20: entering train loop
Task 0 Epoch 13/20 | Loss 0.2506 | Train Acc 0.9885 | Val Acc 0.7639 | Epoch Time 199.33s (Eval 0.00s, Train 199.33s)
[STATE 2025-12-22 14:10:46] Task 0 Epoch 13/20 complete: 199.33s total (0.00s eval/199.33s train)
[STATE 2025-12-22 14:10:46] Task 0 Epoch 14/20: entering train loop
Task 0 Epoch 14/20 | Loss 0.2677 | Train Acc 0.9897 | Val Acc 0.7639 | Epoch Time 198.95s (Eval 0.00s, Train 198.95s)
[STATE 2025-12-22 14:14:04] Task 0 Epoch 14/20 complete: 198.95s total (0.00s eval/198.95s train)
[STATE 2025-12-22 14:14:04] Task 0 Epoch 15/20: entering train loop
Task 0 Epoch 15/20 | Loss 0.2124 | Train Acc 0.9901 | Val Acc 0.7639 | Epoch Time 199.70s (Eval 0.00s, Train 199.70s)
[STATE 2025-12-22 14:17:24] Task 0 Epoch 15/20 complete: 199.70s total (0.00s eval/199.70s train)
[STATE 2025-12-22 14:17:24] Task 0 Epoch 16/20: entering train loop
Task 0 Epoch 16/20 | Loss 0.2258 | Train Acc 0.9917 | Val Acc 0.7639 | Epoch Time 199.31s (Eval 0.00s, Train 199.31s)
[STATE 2025-12-22 14:20:43] Task 0 Epoch 16/20 complete: 199.31s total (0.00s eval/199.31s train)
[STATE 2025-12-22 14:20:43] Task 0 Epoch 17/20: entering train loop
Task 0 Epoch 17/20 | Loss 0.1903 | Train Acc 0.9921 | Val Acc 0.7639 | Epoch Time 199.36s (Eval 0.00s, Train 199.36s)
[STATE 2025-12-22 14:24:03] Task 0 Epoch 17/20 complete: 199.36s total (0.00s eval/199.36s train)
[STATE 2025-12-22 14:24:03] Task 0 Epoch 18/20: entering train loop
Task 0 Epoch 18/20 | Loss 0.1939 | Train Acc 0.9931 | Val Acc 0.7639 | Epoch Time 199.09s (Eval 0.00s, Train 199.09s)
[STATE 2025-12-22 14:27:22] Task 0 Epoch 18/20 complete: 199.09s total (0.00s eval/199.09s train)
[STATE 2025-12-22 14:27:22] Task 0 Epoch 19/20: entering train loop
Task 0 Epoch 19/20 | Loss 0.1776 | Train Acc 0.9941 | Val Acc 0.7639 | Epoch Time 199.04s (Eval 0.00s, Train 199.04s)
[STATE 2025-12-22 14:30:41] Task 0 Epoch 19/20 complete: 199.04s total (0.00s eval/199.04s train)
[STATE 2025-12-22 14:30:41] Task 0 Epoch 20/20: entering train loop
Task 0 Epoch 20/20 | Loss 0.1704 | Train Acc 0.9939 | Val Acc 0.7639 | Epoch Time 194.98s (Eval 0.00s, Train 194.98s)
[STATE 2025-12-22 14:33:56] Task 0 Epoch 20/20 complete: 194.98s total (0.00s eval/194.98s train)
[STATE 2025-12-22 14:33:56] Task 0: running final validation.
[STATE 2025-12-22 14:33:58] Completed task 0 (1/2)
[STATE 2025-12-22 14:33:58] Starting task 1 (2/2)
[STATE 2025-12-22 14:33:58] Task 1 Epoch 1/20: entering train loop
[STATE 2025-12-22 14:33:58] Task 1 Epoch 1/20 Iter 0: running validation
---- Eval at Epoch 0: [0.9356857332872125, 0.37612424116036086] ----
Task 1 Epoch 1/20 | Loss 0.9753 | Train Acc 0.8806 | Val Acc 0.3761 | Epoch Time 244.06s (Eval 1.11s, Train 242.94s)
[STATE 2025-12-22 14:38:02] Task 1 Epoch 1/20 complete: 244.06s total (1.11s eval/242.94s train)
[STATE 2025-12-22 14:38:02] Task 1 Epoch 2/20: entering train loop
Task 1 Epoch 2/20 | Loss 0.7817 | Train Acc 0.9583 | Val Acc 0.3761 | Epoch Time 245.72s (Eval 0.00s, Train 245.72s)
[STATE 2025-12-22 14:42:08] Task 1 Epoch 2/20 complete: 245.72s total (0.00s eval/245.72s train)
[STATE 2025-12-22 14:42:08] Task 1 Epoch 3/20: entering train loop
Task 1 Epoch 3/20 | Loss 0.8941 | Train Acc 0.9734 | Val Acc 0.3761 | Epoch Time 244.88s (Eval 0.00s, Train 244.88s)
[STATE 2025-12-22 14:46:13] Task 1 Epoch 3/20 complete: 244.88s total (0.00s eval/244.88s train)
[STATE 2025-12-22 14:46:13] Task 1 Epoch 4/20: entering train loop
Task 1 Epoch 4/20 | Loss 0.7898 | Train Acc 0.9811 | Val Acc 0.3761 | Epoch Time 245.29s (Eval 0.00s, Train 245.29s)
[STATE 2025-12-22 14:50:18] Task 1 Epoch 4/20 complete: 245.29s total (0.00s eval/245.29s train)
[STATE 2025-12-22 14:50:18] Task 1 Epoch 5/20: entering train loop
Task 1 Epoch 5/20 | Loss 0.7333 | Train Acc 0.9868 | Val Acc 0.3761 | Epoch Time 245.14s (Eval 0.00s, Train 245.14s)
[STATE 2025-12-22 14:54:23] Task 1 Epoch 5/20 complete: 245.14s total (0.00s eval/245.14s train)
[STATE 2025-12-22 14:54:23] Task 1 Epoch 6/20: entering train loop
Task 1 Epoch 6/20 | Loss 0.5510 | Train Acc 0.9919 | Val Acc 0.3761 | Epoch Time 245.28s (Eval 0.00s, Train 245.28s)
[STATE 2025-12-22 14:58:29] Task 1 Epoch 6/20 complete: 245.28s total (0.00s eval/245.28s train)
[STATE 2025-12-22 14:58:29] Task 1 Epoch 7/20: entering train loop
Task 1 Epoch 7/20 | Loss 0.3668 | Train Acc 0.9948 | Val Acc 0.3761 | Epoch Time 244.15s (Eval 0.00s, Train 244.15s)
[STATE 2025-12-22 15:02:33] Task 1 Epoch 7/20 complete: 244.15s total (0.00s eval/244.15s train)
[STATE 2025-12-22 15:02:33] Task 1 Epoch 8/20: entering train loop
Task 1 Epoch 8/20 | Loss 0.2574 | Train Acc 0.9969 | Val Acc 0.3761 | Epoch Time 244.80s (Eval 0.00s, Train 244.80s)
[STATE 2025-12-22 15:06:38] Task 1 Epoch 8/20 complete: 244.80s total (0.00s eval/244.80s train)
[STATE 2025-12-22 15:06:38] Task 1 Epoch 9/20: entering train loop
Task 1 Epoch 9/20 | Loss 0.2296 | Train Acc 0.9977 | Val Acc 0.3761 | Epoch Time 242.54s (Eval 0.00s, Train 242.54s)
[STATE 2025-12-22 15:10:40] Task 1 Epoch 9/20 complete: 242.54s total (0.00s eval/242.54s train)
[STATE 2025-12-22 15:10:40] Task 1 Epoch 10/20: entering train loop
Task 1 Epoch 10/20 | Loss 0.1493 | Train Acc 0.9986 | Val Acc 0.3761 | Epoch Time 242.19s (Eval 0.00s, Train 242.19s)
[STATE 2025-12-22 15:14:42] Task 1 Epoch 10/20 complete: 242.19s total (0.00s eval/242.19s train)
[STATE 2025-12-22 15:14:42] Task 1 Epoch 11/20: entering train loop
[STATE 2025-12-22 15:14:42] Task 1 Epoch 11/20 Iter 0: running validation
---- Eval at Epoch 10: [0.9073802939979411, 0.9899250551331734] ----
Task 1 Epoch 11/20 | Loss 0.1469 | Train Acc 0.9989 | Val Acc 0.9899 | Epoch Time 246.76s (Eval 1.13s, Train 245.64s)
[STATE 2025-12-22 15:18:49] Task 1 Epoch 11/20 complete: 246.76s total (1.13s eval/245.64s train)
[STATE 2025-12-22 15:18:49] Task 1 Epoch 12/20: entering train loop
Task 1 Epoch 12/20 | Loss 0.0816 | Train Acc 0.9992 | Val Acc 0.9899 | Epoch Time 244.19s (Eval 0.00s, Train 244.19s)
[STATE 2025-12-22 15:22:53] Task 1 Epoch 12/20 complete: 244.19s total (0.00s eval/244.19s train)
[STATE 2025-12-22 15:22:53] Task 1 Epoch 13/20: entering train loop
Task 1 Epoch 13/20 | Loss 0.0722 | Train Acc 0.9991 | Val Acc 0.9899 | Epoch Time 241.34s (Eval 0.00s, Train 241.34s)
[STATE 2025-12-22 15:26:55] Task 1 Epoch 13/20 complete: 241.34s total (0.00s eval/241.34s train)
[STATE 2025-12-22 15:26:55] Task 1 Epoch 14/20: entering train loop
Task 1 Epoch 14/20 | Loss 0.0360 | Train Acc 0.9996 | Val Acc 0.9899 | Epoch Time 245.80s (Eval 0.00s, Train 245.80s)
[STATE 2025-12-22 15:31:00] Task 1 Epoch 14/20 complete: 245.80s total (0.00s eval/245.80s train)
[STATE 2025-12-22 15:31:00] Task 1 Epoch 15/20: entering train loop
Task 1 Epoch 15/20 | Loss 0.0463 | Train Acc 0.9996 | Val Acc 0.9899 | Epoch Time 242.04s (Eval 0.00s, Train 242.04s)
[STATE 2025-12-22 15:35:02] Task 1 Epoch 15/20 complete: 242.04s total (0.00s eval/242.04s train)
[STATE 2025-12-22 15:35:02] Task 1 Epoch 16/20: entering train loop
Task 1 Epoch 16/20 | Loss 0.0461 | Train Acc 0.9996 | Val Acc 0.9899 | Epoch Time 243.75s (Eval 0.00s, Train 243.75s)
[STATE 2025-12-22 15:39:06] Task 1 Epoch 16/20 complete: 243.75s total (0.00s eval/243.75s train)
[STATE 2025-12-22 15:39:06] Task 1 Epoch 17/20: entering train loop
Task 1 Epoch 17/20 | Loss 0.0232 | Train Acc 0.9997 | Val Acc 0.9899 | Epoch Time 244.88s (Eval 0.00s, Train 244.88s)
[STATE 2025-12-22 15:43:11] Task 1 Epoch 17/20 complete: 244.88s total (0.00s eval/244.88s train)
[STATE 2025-12-22 15:43:11] Task 1 Epoch 18/20: entering train loop
Task 1 Epoch 18/20 | Loss 0.0244 | Train Acc 0.9999 | Val Acc 0.9899 | Epoch Time 243.84s (Eval 0.00s, Train 243.84s)
[STATE 2025-12-22 15:47:15] Task 1 Epoch 18/20 complete: 243.84s total (0.00s eval/243.84s train)
[STATE 2025-12-22 15:47:15] Task 1 Epoch 19/20: entering train loop
Task 1 Epoch 19/20 | Loss 0.0519 | Train Acc 0.9996 | Val Acc 0.9899 | Epoch Time 244.86s (Eval 0.00s, Train 244.86s)
[STATE 2025-12-22 15:51:20] Task 1 Epoch 19/20 complete: 244.86s total (0.00s eval/244.86s train)
[STATE 2025-12-22 15:51:20] Task 1 Epoch 20/20: entering train loop
Task 1 Epoch 20/20 | Loss 0.0263 | Train Acc 0.9997 | Val Acc 0.9899 | Epoch Time 239.38s (Eval 0.00s, Train 239.38s)
[STATE 2025-12-22 15:55:19] Task 1 Epoch 20/20 complete: 239.38s total (0.00s eval/239.38s train)
[STATE 2025-12-22 15:55:19] Task 1: running final validation.
[STATE 2025-12-22 15:55:21] Completed task 1 (2/2)
####Final Validation Accuracy####
Final Results:- 
 Total Accuracy: 0.9575000731536679 
 Individual Accuracy: [0.9197346329535873, 0.9952655133537486]
[STATE 2025-12-22 15:55:21] Saving results to logs//bcl_dual/bcl_basic_test-2025-12-22_13-28-02-4384/0/results
logs//bcl_dual/bcl_basic_test-2025-12-22_13-28-02-4384/0/results: {'expt_name': 'bcl_basic_test', 'model': 'bcl_dual', 'arch': 'resnet1d', 'n_hiddens': 100, 'n_layers': 2, 'xav_init': True, 'glances': 1, 'n_epochs': 20, 'batch_size': 64, 'replay_batch_size': 10.0, 'memories': 400, 'lr': 0.03, 'cuda': True, 'seed': 0, 'log_every': 3125, 'log_dir': 'logs//bcl_dual/bcl_basic_test-2025-12-22_13-28-02-4384/0', 'tf_dir': 'logs//bcl_dual/bcl_basic_test-2025-12-22_13-28-02-4384/0/tfdir', 'calc_test_accuracy': False, 'state_logging': True, 'data_path': 'data/rff/rfmls', 'loader': 'task_incremental_loader', 'samples_per_task': -1, 'shuffle_tasks': False, 'classes_per_it': 6, 'iterations': 5000, 'dataset': 'iq', 'workers': 0, 'validation': 0.2, 'class_order': 'random', 'increment': 5, 'test_batch_size': 100000, 'nc_per_task': 6, 'val_rate': 10, 'opt_lr': 0.1, 'opt_wt': 0.1, 'alpha_init': 0.1, 'learn_lr': False, 'sync_update': False, 'grad_clip_norm': 5.0, 'cifar_batches': 3, 'use_old_task_memory': False, 'second_order': True, 'n_memories': 5192, 'memory_strength': 1.0, 'steps_per_sample': 1, 'gamma': 1.0, 'beta': 0.1, 's': 1.0, 'batches_per_example': 1.0, 'bgd_optimizer': 'bgd', 'optimizer_params': '{}', 'train_mc_iters': 2, 'std_init': 0.02, 'mean_eta': 50.0, 'fisher_gamma': 0.95, 'rln': 7, 'update_steps': 10, 'meta_lr': 0.001, 'update_lr': 0.1, 'ctn_lr': 0.01, 'ctn_beta': 0.05, 'ctn_n_meta': 2, 'ctn_inner_steps': 2, 'ctn_temperature': 5, 'ctn_n_memories': 50, 'ctn_alpha_init': 0.1, 'ctn_memory_strength': 100, 'ctn_task_emb': 64, 'bcl_n_memories': 2000, 'bcl_memory_strength': 1.0, 'bcl_temperature': 2.0, 'bcl_inner_steps': 5, 'bcl_n_meta': 5, 'bcl_adapt_lr': 0.1} # val: 0.965 0.958 -0.008 0.090 # 8839.14656662941
[STATE 2025-12-22 15:55:21] Results saved; total runtime 8839.15s
New Experiment Starting...
Running model:  meralg1
[STATE 2025-12-22 15:55:24] Experiment 'all_meralg1' starting with model 'meralg1' (seed 0)
Set seed 0
Loaded task0.npz: Unique train labels: [0 1 2 3 4 5]
Loaded task0.npz: Remapped labels: [0 1 2 3 4 5]. Size: 17294)
Loaded task1.npz: Unique train labels: [ 0  6  7  8  9 10]
Loaded task1.npz: Remapped labels: [ 6  7  8  9 10 11]. Size: 32208)
[STATE 2025-12-22 15:55:27] Loader 'task_incremental_loader' ready: 1024 inputs, 12 outputs, 2 tasks
n_outputs: 12 	n_tasks: 2
[STATE 2025-12-22 15:55:27] Logging to logs//meralg1/all_meralg1-2025-12-22_15-55-27-2348/0
True
Model device: cuda:0
[STATE 2025-12-22 15:55:27] Model initialized on device cuda:0
[STATE 2025-12-22 15:55:27] Invoking continual life experience flow
[STATE 2025-12-22 15:55:27] Life experience start: 2 tasks queued
[STATE 2025-12-22 15:55:27] Starting task 0 (1/2)
[STATE 2025-12-22 15:55:27] Task 0 Epoch 1/15: entering train loop
[STATE 2025-12-22 15:55:27] Task 0 Epoch 1/15 Iter 0: running validation
---- Eval at Epoch 0: [0.1807362766855939, 0.20250395400770607] ----
